{
 "seed": "value_templates",
 "schema_version": 1,
 "matrix_version": "1.1.1",
 "sources": [
  {
   "path": "packages/contracts/seed/src/value_templates.yaml",
   "sha256": "1ada5c25ad0c693ce9cb4e8db8ad7eeedc5543d2e88bae171587e3b6071c3637"
  }
 ],
 "number_format": {
  "decimal_separator": ",",
  "group_thousands": false,
  "dimension_separator": "×",
  "unit_separator": " ",
  "percent": "{value}%",
  "per_mille": "{value} ‰"
 },
 "units": {
  "м2": "м²",
  "м3": "м³",
  "мм2": "мм²",
  "см2": "см²",
  "кв.м": "м²",
  "кв. м": "м²",
  "куб.м": "м³",
  "куб. м": "м³",
  "шт": "шт.",
  "дн": "дн.",
  "сут": "сут.",
  "мес": "мес.",
  "тыс.руб": "тыс. руб.",
  "млн.руб": "млн руб."
 },
 "class_formats": [
  {
   "kind": "CONCRETE_CLASS",
   "pattern": "[BВвb]\\s*(\\d{1,3}(?:[.,]\\d)?)",
   "format": "B{1}",
   "requires_kind": true
  },
  {
   "kind": "FIRE_RESISTANCE",
   "pattern": "(REI|EIW|EIS|EI|RE|R|E)\\s*-?\\s*(\\d{2,3})",
   "format": "{1}-{2}"
  },
  {
   "kind": "FROST_RESISTANCE",
   "pattern": "[FfФ]\\s*(\\d{2,4})",
   "format": "F{1}"
  },
  {
   "kind": "WATER_TIGHTNESS",
   "pattern": "[WwВв]\\s*(\\d{1,2})",
   "format": "W{1}",
   "requires_kind": true
  },
  {
   "kind": "MATERIAL_FIRE_CLASS",
   "pattern": "(КМ|KM)\\s*(\\d)",
   "format": "КМ{2}"
  }
 ],
 "cells": {
  "not_applicable": "—",
  "missing": "нет данных"
 },
 "predicates": {
  "предусмотрен": {
   "m": "предусмотрен",
   "f": "предусмотрена",
   "n": "предусмотрено",
   "pl": "предусмотрены"
  },
  "отсутствует": {
   "m": "отсутствует",
   "f": "отсутствует",
   "n": "отсутствует",
   "pl": "отсутствуют"
  },
  "изменён": {
   "m": "изменён",
   "f": "изменена",
   "n": "изменено",
   "pl": "изменены"
  }
 },
 "by_comparison_result": {
  "MISSING_DESIGN_ELEMENT": {
   "PD": "{Element} {~предусмотрен}",
   "RD": "{Element} {~отсутствует}",
   "ID": "{Element} {~отсутствует}"
  },
  "EXTRA_ELEMENT": {
   "PD": "{Element} не {~предусмотрен}",
   "RD": "{Element} {~предусмотрен}",
   "ID": "{Element} {~предусмотрен}"
  },
  "CONFIGURATION_MISMATCH": {
   "PD": "Конфигурация {element_gen} по листу {pd_sheet} ПД",
   "RD": "Конфигурация {element_gen} изменена",
   "ID": "Конфигурация {element_gen} изменена"
  },
  "VALUE_MISMATCH": {
   "PD": "{pd_value}",
   "RD": "{rd_value}",
   "ID": "{id_value}"
  },
  "MATERIAL_SUBSTITUTION": {
   "PD": "{pd_value}",
   "RD": "{rd_value}",
   "ID": "{id_value}"
  },
  "TOLERANCE_EXCEEDED": {
   "PD": "{pd_value}",
   "RD": "{rd_value}",
   "ID": "{id_value}"
  }
 },
 "fallbacks": [
  {
   "placeholder": "pd_sheet",
   "find": " по листу {pd_sheet} ПД",
   "replace": " по ПД"
  },
  {
   "placeholder": "rd_plan_mark",
   "find": " на плане {rd_plan_mark},",
   "replace": " в РД,"
  },
  {
   "placeholder": "location",
   "find": ", помещение {location}",
   "replace": ""
  }
 ],
 "nouns": {
  "VENT_SUPPLY_UNIT": {
   "nom": "Приточная установка",
   "agr": "f",
   "gen": "приточных установок"
  },
  "VENT_EXHAUST_UNIT": {
   "nom": "Вытяжная установка",
   "agr": "f",
   "gen": "вытяжных установок"
  },
  "VENT_EXHAUST_BRANCH": {
   "nom": "Вытяжная вентиляция",
   "agr": "f",
   "gen": "вентиляции"
  },
  "VENT_DUCT": {
   "nom": "Воздуховод",
   "agr": "m",
   "gen": "воздуховодов"
  },
  "SMOKE_CONTROL_FAN": {
   "nom": "Система противодымной вентиляции",
   "agr": "f",
   "gen": "противодымной вентиляции"
  },
  "FIRE_DAMPER": {
   "nom": "Огнезадерживающий клапан",
   "agr": "m",
   "gen": "огнезадерживающих клапанов"
  },
  "WARM_FLOOR": {
   "nom": "Тёплый пол",
   "agr": "m",
   "gen": "тёплого пола"
  },
  "HEATING_DEVICE": {
   "nom": "Отопительный прибор",
   "agr": "m",
   "gen": "отопительных приборов"
  },
  "HEATING_PIPE": {
   "nom": "Трубопровод отопления",
   "agr": "m",
   "gen": "трубопроводов отопления"
  },
  "HEAT_POINT": {
   "nom": "Оборудование теплового пункта",
   "agr": "n",
   "gen": "теплового пункта"
  },
  "HEAT_LOAD": {
   "nom": "Тепловая нагрузка",
   "agr": "f",
   "gen": "тепловой нагрузки"
  },
  "WATER_PIPE": {
   "nom": "Трубопровод водоснабжения",
   "agr": "m",
   "gen": "трубопроводов водоснабжения"
  },
  "WATER_PUMP": {
   "nom": "Насосная установка",
   "agr": "f",
   "gen": "насосных установок"
  },
  "SANITARY_FIXTURE": {
   "nom": "Санитарный прибор",
   "agr": "m",
   "gen": "санитарных приборов"
  },
  "SEWER_PIPE": {
   "nom": "Трубопровод канализации",
   "agr": "m",
   "gen": "трубопроводов канализации"
  },
  "ROOF_DRAIN": {
   "nom": "Водосточная воронка",
   "agr": "f",
   "gen": "водосточных воронок"
  },
  "FIRE_WATER_INTERNAL": {
   "nom": "Пожарный кран",
   "agr": "m",
   "gen": "внутреннего противопожарного водопровода"
  },
  "FIRE_HYDRANT": {
   "nom": "Пожарный гидрант",
   "agr": "m",
   "gen": "наружного противопожарного водоснабжения"
  },
  "SWITCHGEAR_PROTECTION": {
   "nom": "Аппарат защиты",
   "agr": "m",
   "gen": "аппаратов защиты"
  },
  "POWER_CABLE": {
   "nom": "Питающий кабель",
   "agr": "m",
   "gen": "питающих кабелей"
  },
  "FIRE_SAFETY_CABLE": {
   "nom": "Кабель систем противопожарной защиты",
   "agr": "m",
   "gen": "кабельных линий систем противопожарной защиты"
  },
  "GROUNDING": {
   "nom": "Элементы молниезащиты",
   "agr": "pl",
   "gen": "заземления и молниезащиты"
  },
  "LIGHTING_FIXTURE": {
   "nom": "Освещение",
   "agr": "n",
   "gen": "освещения"
  },
  "ENERGY_METER": {
   "nom": "Прибор учёта",
   "agr": "m",
   "gen": "узлов учёта"
  },
  "POWER_LOAD": {
   "nom": "Расчётная электрическая мощность",
   "agr": "f",
   "gen": "электроснабжения"
  },
  "FIRE_DETECTOR": {
   "nom": "Пожарные извещатели",
   "agr": "pl",
   "gen": "пожарных извещателей"
  },
  "FIRE_ALARM_SYSTEM": {
   "nom": "Система пожарной сигнализации",
   "agr": "f",
   "gen": "системы пожарной сигнализации"
  },
  "EVACUATION_ALERT": {
   "nom": "Табло «Выход»",
   "agr": "n",
   "gen": "системы оповещения"
  },
  "FIRE_DOOR": {
   "nom": "Противопожарная дверь",
   "agr": "f",
   "gen": "противопожарных дверей"
  },
  "FIRE_COMPARTMENT": {
   "nom": "Противопожарная преграда",
   "agr": "f",
   "gen": "противопожарных преград"
  },
  "FIRE_PROTECTION_COATING": {
   "nom": "Огнезащитное покрытие",
   "agr": "n",
   "gen": "огнезащиты"
  },
  "EVAC_CORRIDOR": {
   "nom": "Эвакуационный коридор",
   "agr": "m",
   "gen": "эвакуационных коридоров"
  },
  "EVAC_DOOR": {
   "nom": "Эвакуационный выход",
   "agr": "m",
   "gen": "эвакуационных выходов"
  },
  "DOOR_SWING": {
   "nom": "Открывание по направлению выхода",
   "agr": "n",
   "gen": "открывания дверей"
  },
  "EVAC_HEIGHT": {
   "nom": "Путь эвакуации",
   "agr": "m",
   "gen": "путей эвакуации"
  },
  "FINISH_MATERIAL": {
   "nom": "Отделочный материал",
   "agr": "m",
   "gen": "отделки путей эвакуации"
  },
  "WINDOW": {
   "nom": "Оконный блок",
   "agr": "m",
   "gen": "оконных блоков"
  },
  "WINDOW_THERMAL": {
   "nom": "Оконный блок",
   "agr": "m",
   "gen": "оконных блоков"
  },
  "ROOF_ASSEMBLY": {
   "nom": "Слой кровли",
   "agr": "m",
   "gen": "кровли"
  },
  "ROOF_INSULATION": {
   "nom": "Утеплитель покрытия",
   "agr": "m",
   "gen": "утепления покрытия"
  },
  "ROOF_SLOPE": {
   "nom": "Уклон кровли",
   "agr": "m",
   "gen": "кровли"
  },
  "STAIR": {
   "nom": "Лестничный марш",
   "agr": "m",
   "gen": "лестниц"
  },
  "RAILING": {
   "nom": "Ограждение",
   "agr": "n",
   "gen": "ограждений"
  },
  "VESTIBULE": {
   "nom": "Тамбур",
   "agr": "m",
   "gen": "тамбура"
  },
  "FACADE_FINISH": {
   "nom": "Облицовка фасада",
   "agr": "f",
   "gen": "фасада"
  },
  "NOISE_PROTECTION": {
   "nom": "Звукоизоляционные мероприятия",
   "agr": "pl",
   "gen": "звукоизоляции"
  },
  "ROOM": {
   "nom": "Помещение",
   "agr": "n",
   "gen": "помещений"
  },
  "APARTMENT_MIX": {
   "nom": "Квартирография",
   "agr": "f",
   "gen": "квартир"
  },
  "MGN_LIFT": {
   "nom": "Подъёмная платформа для МГН",
   "agr": "f",
   "gen": "подъёмных платформ для МГН"
  },
  "MGN_PATH": {
   "nom": "Путь движения МГН",
   "agr": "m",
   "gen": "путей движения МГН"
  },
  "MGN_DOOR": {
   "nom": "Дверной проём",
   "agr": "m",
   "gen": "дверных проёмов"
  },
  "DOOR_THRESHOLD": {
   "nom": "Порог",
   "agr": "m",
   "gen": "порогов"
  },
  "MGN_WC": {
   "nom": "Универсальная кабина",
   "agr": "f",
   "gen": "универсальной кабины"
  },
  "GRAB_BAR": {
   "nom": "Поручни",
   "agr": "pl",
   "gen": "поручней"
  },
  "TACTILE_INDICATOR": {
   "nom": "Тактильные указатели",
   "agr": "pl",
   "gen": "тактильных указателей"
  },
  "CALL_SYSTEM": {
   "nom": "Система вызова",
   "agr": "f",
   "gen": "системы вызова"
  },
  "MGN_PARKING": {
   "nom": "Место для автотранспорта МГН",
   "agr": "n",
   "gen": "мест для автотранспорта МГН"
  },
  "PASSENGER_LIFT": {
   "nom": "Лифт",
   "agr": "m",
   "gen": "лифтов"
  },
  "CONCRETE_CLASS": {
   "nom": "Класс бетона",
   "agr": "m",
   "gen": "бетона"
  },
  "CONCRETE_FW_MARK": {
   "nom": "Марка бетона",
   "agr": "f",
   "gen": "бетона"
  },
  "STEEL_GRADE": {
   "nom": "Марка стали",
   "agr": "f",
   "gen": "металлоконструкций"
  },
  "REBAR_CLASS": {
   "nom": "Класс арматуры",
   "agr": "m",
   "gen": "армирования"
  },
  "REBAR_DIAMETER": {
   "nom": "Продольная арматура",
   "agr": "f",
   "gen": "армирования"
  },
  "FOUNDATION_SLAB": {
   "nom": "Фундаментная плита",
   "agr": "f",
   "gen": "фундамента"
  },
  "FLOOR_SLAB": {
   "nom": "Плита перекрытия",
   "agr": "f",
   "gen": "перекрытия"
  },
  "COLUMN_SECTION": {
   "nom": "Колонна",
   "agr": "f",
   "gen": "колонн"
  },
  "BEARING_WALL": {
   "nom": "Несущая стена",
   "agr": "f",
   "gen": "несущих стен"
  },
  "STRUCTURE_AXES": {
   "nom": "Координационная ось",
   "agr": "f",
   "gen": "осей"
  },
  "STRUCTURE_ELEVATION": {
   "nom": "Отметка верха конструкции",
   "agr": "f",
   "gen": "отметок"
  },
  "STRUCTURE_REPAIR_WORKS": {
   "nom": "Работы по ремонту и усилению",
   "agr": "pl",
   "gen": "ремонта и усиления"
  },
  "EXPANSION_JOINT": {